lane,status,claim_level,primary_artifacts,next_action
W7-X zonal long-window recurrence/damping,open,open_physical_closure_not_normalization,docs/_static/w7x_zonal_reference_compare.json;docs/_static/w7x_zonal_recurrence_sweep_kx070.json;docs/_static/w7x_zonal_hypercollision_probe_kx070.json;docs/_static/w7x_zonal_mixedlm_resolution_kx070.json,"Move beyond constant Hermite and mixed Laguerre-Hermite damping: test a closure/operator that improves trace error, late-window envelope, and moment-tail gates together without losing high-moment stability."
W7-X fluctuation spectrum and TEM/multi-flux extension,partial,validated_simulation_spectrum_tem_extension_open,docs/_static/w7x_fluctuation_spectrum_panel.json;docs/_static/w7x_tem_extension_status.json;docs/_static/tem_branch_parity_audit.json;docs/_static/tem_mismatch_table.csv,Add W7-X multi-alpha/multi-surface ITG and kinetic-electron density-gradient/TEM scans before broad stellarator-validation claims.
Scoped core quasilinear model-development diagnostic,closed,scoped_core_absolute_flux_diagnostic_not_universal_predictor,docs/_static/quasilinear_validated_calibration_inputs.json;docs/_static/quasilinear_stellarator_train_holdout_report.json;docs/_static/quasilinear_candidate_uncertainty.json;docs/_static/quasilinear_error_anatomy.json;docs/_static/quasilinear_dataset_sufficiency.json;docs/_static/quasilinear_model_selection_status.json;docs/_static/external_vmec_circular_t250_high_grid_convergence_gate.json;docs/_static/external_vmec_circular_replicates/circular_replicate_t700_ensemble_gate.json;docs/_static/external_vmec_dshape_t250_high_grid_convergence_gate.json;docs/_static/external_vmec_dshape_replicates/dshape_replicate_t250_ensemble_gate.json;docs/_static/production_nonlinear_optimization_guard.json;docs/_static/optimized_equilibrium_replicates/optimized_equilibrium_replicate_t700_ensemble_gate.json;docs/_static/qa_no_ess_reference_replicates/qa_no_ess_reference_t700_ensemble_gate.json;docs/_static/qa_no_ess_to_optimized_nonlinear_audit.json;docs/_static/qa_ess_zbs10_rel7p5_control_mean_tmin600_t1100_gate.json;docs/_static/external_vmec_itermodel_t350_high_grid_convergence_gate.json;docs/_static/external_vmec_updown_asym_t450_high_grid_convergence_gate.json;docs/_static/external_vmec_qh_grid_convergence_gate.json;docs/_static/external_vmec_qh_high_grid_convergence_gate.json;docs/_static/external_vmec_cth_like_grid_convergence_gate.json;docs/_static/external_vmec_cth_like_modified_high_grid_admission_gate.json,Use the closed scoped-core QL diagnostic for examples and optimization screening; keep declared stress outliers deferred until a new saturation-physics lane is opened.
vmec_jax / booz_xform_jax differentiable geometry bridge,partial,contract_gradient_gate_not_full_stellarator_optimization,docs/_static/differentiable_geometry_bridge.json;docs/_static/vmec_boozer_parity_matrix.json,Generalize the now-matched zero-beta Boozer equal-arc core/metric/drift convention across finite-beta pressure corrections and solver-objective geometry gradients for growth-rate/quasilinear gates.
Profiler-backed nonlinear hot-path optimization,closed,release_hot_path_localization_closed_future_optimization_scoped,docs/_static/nonlinear_sharding_profile_office_gpu.json;docs/_static/nonlinear_rhs_profile.json;docs/_static/nonlinear_rhs_profile_miller.json;docs/_static/nonlinear_rhs_profile_stellarator_runtime.json;docs/_static/full_nonlinear_rhs_trace_summary.json;docs/_static/full_nonlinear_rhs_trace_gpu_summary.json,Release hot-path localization is closed with matched CPU/GPU profiler artifacts and conservative claim scope; continue larger-state algorithmic optimization as a future science/performance lane.
